[
  {
    "retailer": "lidl",
    "product_name": "Controfiletti di pollo",
    "price": 2.69,
    "currency": "EUR",
    "reference_price": 3.69,
    "packaging_text": "400 g confezione",
    "base_price_text": "1 kg = 6.73 €",
    "promotion": {
      "type": "lidl_plus",
      "requires_loyalty": true,
      "discount_text": "-27%"
    },
    "validity": {
      "from": "2026-08-14T12:32:41.009Z",
      "to": "2026-08-26T22:00Z"
    },
    "locality": {
      "scope": "regional",
      "stores": [
        "IT01621",
        "IT00302"
      ],
      "offer_region": "600",
      "offer_region_name": "Pontedera - Toscana"
    },
    "verification": {
      "locality_status": "verified",
      "evidence_status": "unmatched",
      "flyer_pages": []
    },
    "provenance": {
      "source_type": "official_web",
      "source_url": "https://www.lidl.it/c/lidl-plus-kw-34-26/a10101068",
      "observed_at": "2026-08-25T16:24:40.805384+00:00",
      "flyer_id": "019ffb0b-9032-7c0d-afca-7dbfde94b923"
    }
  },
  {
    "retailer": "lidl",
    "product_name": "Peperone Corno Sweet Palermo",
    "price": 1.79,
    "currency": "EUR",
    "reference_price": 2.49,
    "packaging_text": "500 g confezione",
    "base_price_text": "1 kg = 3.58 €",
    "promotion": {
      "type": "lidl_plus",
      "requires_loyalty": true,
      "discount_text": "-28%"
    },
    "validity": {
      "from": "2026-08-14T12:32:41.015Z",
      "to": "2026-08-26T22:00Z"
    },
    "locality": {
      "scope": "regional",
      "stores": [
        "IT01621",
        "IT00302"
      ],
      "offer_region": "600",
      "offer_region_name": "Pontedera - Toscana"
    },
    "verification": {
      "locality_status": "verified",
      "evidence_status": "verified",
      "flyer_pages": [
        5
      ]
    },
    "provenance": {
      "source_type": "official_web",
      "source_url": "https://www.lidl.it/c/lidl-plus-kw-34-26/a10101068",
      "observed_at": "2026-08-25T16:24:40.805384+00:00",
      "flyer_id": "019ffb0b-9032-7c0d-afca-7dbfde94b923"
    }
  },
  {
    "retailer": "lidl",
    "product_name": "Petto di pollo disossato",
    "price": 3.29,
    "currency": "EUR",
    "reference_price": 4.29,
    "packaging_text": "400 g confezione",
    "base_price_text": "1 kg = 8.23 €",
    "promotion": {
      "type": "lidl_plus",
      "requires_loyalty": true,
      "discount_text": "-1.00€"
    },
    "validity": {
      "from": "2026-08-14T12:32:41.026Z",
      "to": "2026-08-26T22:00Z"
    },
    "locality": {
      "scope": "regional",
      "stores": [
        "IT01621",
        "IT00302"
      ],
      "offer_region": "600",
      "offer_region_name": "Pontedera - Toscana"
    },
    "verification": {
      "locality_status": "verified",
      "evidence_status": "verified",
      "flyer_pages": [
        8
      ]
    },
    "provenance": {
      "source_type": "official_web",
      "source_url": "https://www.lidl.it/c/lidl-plus-kw-34-26/a10101068",
      "observed_at": "2026-08-25T16:24:40.805384+00:00",
      "flyer_id": "019ffb0b-9032-7c0d-afca-7dbfde94b923"
    }
  },
  {
    "retailer": "lidl",
    "product_name": "Sushi set Mukawa",
    "price": 3.79,
    "currency": "EUR",
    "reference_price": 4.99,
    "packaging_text": "326 g confezione",
    "base_price_text": "1 kg = 11.63 €",
    "promotion": {
      "type": "lidl_plus",
      "requires_loyalty": true,
      "discount_text": "-24%"
    },
    "validity": {
      "from": "2026-08-14T12:32:41.031Z",
      "to": "2026-08-26T22:00Z"
    },
    "locality": {
      "scope": "regional",
      "stores": [
        "IT01621",
        "IT00302"
      ],
      "offer_region": "600",
      "offer_region_name": "Pontedera - Toscana"
    },
    "verification": {
      "locality_status": "verified",
      "evidence_status": "verified",
      "flyer_pages": [
        9
      ]
    },
    "provenance": {
      "source_type": "official_web",
      "source_url": "https://www.lidl.it/c/lidl-plus-kw-34-26/a10101068",
      "observed_at": "2026-08-25T16:24:40.805384+00:00",
      "flyer_id": "019ffb0b-9032-7c0d-afca-7dbfde94b923"
    }
  },
  {
    "retailer": "lidl",
    "product_name": "Pizza trio",
    "price": 4.89,
    "currency": "EUR",
    "reference_price": 6.49,
    "packaging_text": "1150 g confezione",
    "base_price_text": "1 kg = 4.25 €",
    "promotion": {
      "type": "lidl_plus",
      "requires_loyalty": true,
      "discount_text": "-24%"
    },
    "validity": {
      "from": "2026-08-14T12:32:41.037Z",
      "to": "2026-08-26T22:00Z"
    },
    "locality": {
      "scope": "regional",
      "stores": [
        "IT01621",
        "IT00302"
      ],
      "offer_region": "600",
      "offer_region_name": "Pontedera - Toscana"
    },
    "verification": {
      "locality_status": "verified",
      "evidence_status": "verified",
      "flyer_pages": [
        14
      ]
    },
    "provenance": {
      "source_type": "official_web",
      "source_url": "https://www.lidl.it/c/lidl-plus-kw-34-26/a10101068",
      "observed_at": "2026-08-25T16:24:40.805384+00:00",
      "flyer_id": "019ffb0b-9032-7c0d-afca-7dbfde94b923"
    }
  },
  {
    "retailer": "lidl",
    "product_name": "Funghi interi",
    "price": 1.39,
    "currency": "EUR",
    "reference_price": 1.85,
    "packaging_text": "185 g (sgocc.) conf.",
    "base_price_text": "1 kg (sgocc.) = 7.51 €",
    "promotion": {
      "type": "lidl_plus",
      "requires_loyalty": true,
      "discount_text": "-24%"
    },
    "validity": {
      "from": "2026-08-14T12:32:41.042Z",
      "to": "2026-08-26T22:00Z"
    },
    "locality": {
      "scope": "regional",
      "stores": [
        "IT01621",
        "IT00302"
      ],
      "offer_region": "600",
      "offer_region_name": "Pontedera - Toscana"
    },
    "verification": {
      "locality_status": "verified",
      "evidence_status": "unmatched",
      "flyer_pages": []
    },
    "provenance": {
      "source_type": "official_web",
      "source_url": "https://www.lidl.it/c/lidl-plus-kw-34-26/a10101068",
      "observed_at": "2026-08-25T16:24:40.805384+00:00",
      "flyer_id": "019ffb0b-9032-7c0d-afca-7dbfde94b923"
    }
  },
  {
    "retailer": "lidl",
    "product_name": "Olive Taggiasche denocciolate",
    "price": 1.89,
    "currency": "EUR",
    "reference_price": 2.49,
    "packaging_text": "120 g (sgocc.) confezione",
    "base_price_text": "1 kg (sgocc.) = 15.75 €",
    "promotion": {
      "type": "lidl_plus",
      "requires_loyalty": true,
      "discount_text": "-24%"
    },
    "validity": {
      "from": "2026-08-14T12:32:41.048Z",
      "to": "2026-08-26T22:00Z"
    },
    "locality": {
      "scope": "regional",
      "stores": [
        "IT01621",
        "IT00302"
      ],
      "offer_region": "600",
      "offer_region_name": "Pontedera - Toscana"
    },
    "verification": {
      "locality_status": "verified",
      "evidence_status": "verified",
      "flyer_pages": [
        15
      ]
    },
    "provenance": {
      "source_type": "official_web",
      "source_url": "https://www.lidl.it/c/lidl-plus-kw-34-26/a10101068",
      "observed_at": "2026-08-25T16:24:40.805384+00:00",
      "flyer_id": "019ffb0b-9032-7c0d-afca-7dbfde94b923"
    }
  },
  {
    "retailer": "lidl",
    "product_name": "Formaggio a pasta filata",
    "price": 1.49,
    "currency": "EUR",
    "reference_price": 1.99,
    "packaging_text": "300 g confezione",
    "base_price_text": "1 kg = 4.97 €",
    "promotion": {
      "type": "lidl_plus",
      "requires_loyalty": true,
      "discount_text": "-25%"
    },
    "validity": {
      "from": "2026-08-14T12:32:41.054Z",
      "to": "2026-08-26T22:00Z"
    },
    "locality": {
      "scope": "regional",
      "stores": [
        "IT01621",
        "IT00302"
      ],
      "offer_region": "600",
      "offer_region_name": "Pontedera - Toscana"
    },
    "verification": {
      "locality_status": "verified",
      "evidence_status": "verified",
      "flyer_pages": [
        16
      ]
    },
    "provenance": {
      "source_type": "official_web",
      "source_url": "https://www.lidl.it/c/lidl-plus-kw-34-26/a10101068",
      "observed_at": "2026-08-25T16:24:40.805384+00:00",
      "flyer_id": "019ffb0b-9032-7c0d-afca-7dbfde94b923"
    }
  },
  {
    "retailer": "lidl",
    "product_name": "Birra",
    "price": 1.99,
    "currency": "EUR",
    "reference_price": 2.79,
    "packaging_text": "3x 330 ml confezione",
    "base_price_text": "1 l = 2.01 €",
    "promotion": {
      "type": "lidl_plus",
      "requires_loyalty": true,
      "discount_text": "-28%"
    },
    "validity": {
      "from": "2026-08-14T12:32:41.059Z",
      "to": "2026-08-26T22:00Z"
    },
    "locality": {
      "scope": "regional",
      "stores": [
        "IT01621",
        "IT00302"
      ],
      "offer_region": "600",
      "offer_region_name": "Pontedera - Toscana"
    },
    "verification": {
      "locality_status": "verified",
      "evidence_status": "verified",
      "flyer_pages": [
        3,
        11,
        16,
        17,
        20
      ]
    },
    "provenance": {
      "source_type": "official_web",
      "source_url": "https://www.lidl.it/c/lidl-plus-kw-34-26/a10101068",
      "observed_at": "2026-08-25T16:24:40.805384+00:00",
      "flyer_id": "019ffb0b-9032-7c0d-afca-7dbfde94b923"
    }
  },
  {
    "retailer": "lidl",
    "product_name": "Grana Padano DOP a cubetti",
    "price": 4.29,
    "currency": "EUR",
    "reference_price": 4.79,
    "packaging_text": "300 g confezione",
    "base_price_text": "1 kg = 14.30 €",
    "promotion": {
      "type": "lidl_plus",
      "requires_loyalty": true,
      "discount_text": "-0.50€"
    },
    "validity": {
      "from": "2026-08-14T12:32:41.065Z",
      "to": "2026-08-26T22:00Z"
    },
    "locality": {
      "scope": "regional",
      "stores": [
        "IT01621",
        "IT00302"
      ],
      "offer_region": "600",
      "offer_region_name": "Pontedera - Toscana"
    },